{
  "$schema": "https://json-schema.org/draft/2020-12/schema",
  "$id": "https://volatoo.org/schemas/build-spec-v1.schema.json",
  "title": "Volatoo BuildSpec v1",
  "type": "object",
  "additionalProperties": false,
  "required": [
    "schema",
    "target_id",
    "build_context_digest",
    "request",
    "resolver",
    "packages"
  ],
  "properties": {
    "schema": {
      "const": "org.volatoo.build-spec/v1"
    },
    "target_id": {
      "$ref": "#/$defs/identifier"
    },
    "build_context_digest": {
      "$ref": "#/$defs/digest"
    },
    "request": {
      "type": "object",
      "additionalProperties": false,
      "required": [
        "atoms",
        "selection"
      ],
      "properties": {
        "atoms": {
          "type": "array",
          "minItems": 1,
          "uniqueItems": true,
          "items": {
            "type": "string",
            "minLength": 1,
            "maxLength": 512,
            "pattern": "^\\S+$"
          }
        },
        "selection": {
          "enum": [
            "oneshot",
            "world"
          ]
        }
      }
    },
    "resolver": {
      "type": "object",
      "additionalProperties": false,
      "required": [
        "name",
        "version",
        "adapter",
        "options"
      ],
      "properties": {
        "name": {
          "const": "portage"
        },
        "version": {
          "$ref": "#/$defs/value"
        },
        "adapter": {
          "$ref": "#/$defs/value"
        },
        "options": {
          "type": "array",
          "minItems": 1,
          "uniqueItems": true,
          "items": {
            "type": "string",
            "minLength": 1,
            "maxLength": 256,
            "pattern": "^\\S+$"
          }
        }
      }
    },
    "packages": {
      "type": "array",
      "items": {
        "$ref": "#/$defs/package"
      }
    }
  },
  "$defs": {
    "digest": {
      "type": "string",
      "pattern": "^sha256:[0-9a-f]{64}$"
    },
    "identifier": {
      "type": "string",
      "minLength": 3,
      "maxLength": 192,
      "pattern": "^[a-z0-9][a-z0-9._+-]*(/[a-z0-9][a-z0-9._+-]*)+$"
    },
    "name": {
      "type": "string",
      "minLength": 1,
      "maxLength": 64,
      "pattern": "^[a-z0-9][a-z0-9._+-]*$"
    },
    "token": {
      "type": "string",
      "minLength": 1,
      "maxLength": 256,
      "pattern": "^[A-Za-z0-9*~-][A-Za-z0-9._+@*~-]*$"
    },
    "value": {
      "type": "string",
      "minLength": 1,
      "maxLength": 128,
      "pattern": "^[A-Za-z0-9][A-Za-z0-9._+~-]*$"
    },
    "sortedTokens": {
      "type": "array",
      "uniqueItems": true,
      "items": {
        "$ref": "#/$defs/token"
      }
    },
    "buildFlags": {
      "type": "object",
      "additionalProperties": false,
      "required": [
        "cflags",
        "cxxflags",
        "fflags",
        "fcflags",
        "ldflags",
        "features"
      ],
      "properties": {
        "cflags": {
          "type": "string",
          "maxLength": 4096
        },
        "cxxflags": {
          "type": "string",
          "maxLength": 4096
        },
        "fflags": {
          "type": "string",
          "maxLength": 4096
        },
        "fcflags": {
          "type": "string",
          "maxLength": 4096
        },
        "ldflags": {
          "type": "string",
          "maxLength": 4096
        },
        "features": {
          "$ref": "#/$defs/sortedTokens"
        }
      }
    },
    "dependencies": {
      "type": "object",
      "additionalProperties": false,
      "required": [
        "bdepend",
        "depend",
        "idepend",
        "pdepend",
        "rdepend"
      ],
      "properties": {
        "bdepend": {
          "type": "string",
          "maxLength": 65536
        },
        "depend": {
          "type": "string",
          "maxLength": 65536
        },
        "idepend": {
          "type": "string",
          "maxLength": 65536
        },
        "pdepend": {
          "type": "string",
          "maxLength": 65536
        },
        "rdepend": {
          "type": "string",
          "maxLength": 65536
        }
      }
    },
    "package": {
      "type": "object",
      "additionalProperties": false,
      "required": [
        "sequence",
        "cpv",
        "repository",
        "slot",
        "subslot",
        "eapi",
        "operation",
        "source_type",
        "use",
        "acceptance",
        "build_flags",
        "dependencies",
        "metadata"
      ],
      "properties": {
        "sequence": {
          "type": "integer",
          "minimum": 0
        },
        "cpv": {
          "type": "string",
          "minLength": 1,
          "maxLength": 512,
          "pattern": "^\\S+$"
        },
        "repository": {
          "$ref": "#/$defs/name"
        },
        "slot": {
          "$ref": "#/$defs/token"
        },
        "subslot": {
          "$ref": "#/$defs/token"
        },
        "eapi": {
          "$ref": "#/$defs/token"
        },
        "operation": {
          "const": "merge"
        },
        "source_type": {
          "enum": [
            "ebuild",
            "binary"
          ]
        },
        "use": {
          "type": "object",
          "additionalProperties": false,
          "required": [
            "enabled",
            "iuse"
          ],
          "properties": {
            "enabled": {
              "$ref": "#/$defs/sortedTokens"
            },
            "iuse": {
              "$ref": "#/$defs/sortedTokens"
            }
          }
        },
        "acceptance": {
          "type": "object",
          "additionalProperties": false,
          "required": [
            "keywords",
            "licenses"
          ],
          "properties": {
            "keywords": {
              "$ref": "#/$defs/sortedTokens"
            },
            "licenses": {
              "$ref": "#/$defs/sortedTokens"
            }
          }
        },
        "build_flags": {
          "$ref": "#/$defs/buildFlags"
        },
        "dependencies": {
          "$ref": "#/$defs/dependencies"
        },
        "metadata": {
          "type": "object",
          "additionalProperties": false,
          "required": [
            "keywords",
            "license",
            "properties",
            "required_use",
            "restrict"
          ],
          "properties": {
            "keywords": {
              "type": "string",
              "maxLength": 65536
            },
            "license": {
              "type": "string",
              "maxLength": 65536
            },
            "properties": {
              "type": "string",
              "maxLength": 65536
            },
            "required_use": {
              "type": "string",
              "maxLength": 65536
            },
            "restrict": {
              "type": "string",
              "maxLength": 65536
            }
          }
        }
      }
    }
  }
}
